{
  "schemaVersion": "2.0",
  "meta": {
    "reportTitle": "Q3 review · AI Smart Replenishment Suggestions",
    "reportDate": "2026-10-13",
    "outputMode": "C",
    "projectStage": "Go / no-go review · revisit in two weeks",
    "subtitle": "Fictional material for a biz-retro-analyzer demo. The company, people, and numbers are invented.",
    "lead": "What Zhou called in the room was a time-boxed evaluation: alerts first, a light demo for replenishment, look again in two weeks. The follow-up group message rewrote that as “replenishment confirmed as a Q3 priority, alerts after the demo.” Both premises for replenishment — data coverage and what customers actually asked for — were contradicted in the meeting.",
    "language": "en",
    "audience": "internal",
    "interactionContext": "formal_meeting",
    "analysisWindow": "00:00-05:05, 06:40-14:00 (Zhou in the room 08:30-12:15)",
    "noiseNote": "05:05-06:40 room-booking / screen drop and 14:00-14:50 small talk were isolated. 10:15 contains “dinner”; that line is kept because it is evidence.",
    "generatedBy": "Hand analysis following SKILL.md Mode C, then written as report JSON"
  },
  "sources": [
    {
      "id": "S1",
      "label": "Q3 product-review transcript",
      "layer": "source",
      "type": "speech-to-text transcript",
      "path": "transcript.txt",
      "speakerAttribution": "reliable",
      "note": "About 15 minutes, speakers A-E"
    },
    {
      "id": "S2",
      "label": "Gao Yuan's post-meeting group message",
      "layer": "source",
      "type": "group chat",
      "path": "group-message.txt",
      "note": "Shows how Gao stated the conclusion, not that the meeting made those conclusions"
    },
    {
      "id": "C1",
      "label": "Lin Xiaolu's background note",
      "layer": "context",
      "type": "user note",
      "path": "context.txt",
      "note": "The person asking for the analysis; not independent evidence"
    }
  ],
  "summary": [
    {
      "label": "Decision",
      "headline": "The room decided on a time-boxed evaluation, not a kickoff",
      "body": "Both tracks in parallel, alerts first, a light demo for replenishment, revisit in two weeks.",
      "status": "Confirmed",
      "strength": "High",
      "anchors": [
        {
          "speaker": "E Zhou",
          "ts": "11:12",
          "quote": "alerts first"
        },
        {
          "speaker": "E Zhou",
          "ts": "11:45",
          "quote": "Keep the demo light"
        }
      ]
    },
    {
      "label": "Consistency",
      "headline": "The group message disagrees with the CEO in three places",
      "body": "“Confirmed as a Q3 priority,” “priority after the demo,” and “customer demand is validated” are not in the transcript.",
      "status": "Confirmed",
      "strength": "High",
      "anchors": [
        {
          "source": "S2",
          "quote": "confirmed as a Q3 priority"
        },
        {
          "speaker": "E Zhou",
          "ts": "09:32",
          "quote": "I didn't say replenishment had to go first"
        }
      ]
    },
    {
      "label": "Premises",
      "headline": "Data coverage is about 7%; customers asked for alerts",
      "body": "Stores with 90 days of SKU-level inventory: about 7%. A named customer said the system should not decide order quantities.",
      "status": "Confirmed",
      "strength": "High",
      "anchors": [
        {
          "speaker": "B Su Qing",
          "ts": "02:10",
          "quote": "about seven percent"
        },
        {
          "speaker": "D Lin Xiaolu",
          "ts": "03:55",
          "quote": "don't let the system decide for us"
        }
      ]
    },
    {
      "label": "Consensus",
      "headline": "“Both tracks” is a false consensus",
      "body": "A four-person team cannot staff both tracks. Priority was never defined. After Zhou left it was rewritten unilaterally.",
      "status": "Inferred",
      "strength": "Medium",
      "anchors": [
        {
          "speaker": "C Ma Jun",
          "ts": "11:33"
        },
        {
          "speaker": "A Gao Yuan",
          "ts": "13:22",
          "quote": "staff the demo first"
        }
      ]
    }
  ],
  "evidenceLayer": [
    {
      "title": "Source 1 · review transcript",
      "source": "S1",
      "status": "Confirmed",
      "notes": "Who said what. Said is not the same as true.",
      "points": [
        {
          "text": "The six person-month estimate was never formally done by engineering.",
          "anchors": [
            {
              "speaker": "C Ma Jun",
              "ts": "01:35",
              "quote": "we never did a formal estimate"
            }
          ]
        },
        {
          "text": "Of 1,200+ active stores, about 7% (eighty-something) have 90 straight days of SKU-level inventory records.",
          "anchors": [
            {
              "speaker": "B Su Qing",
              "ts": "02:10"
            }
          ]
        },
        {
          "text": "First-half churn: 41 accounts; only 3 left explicitly for Shelfwise.",
          "anchors": [
            {
              "speaker": "B Su Qing",
              "ts": "02:38",
              "quote": "only three of them left explicitly for Shelfwise"
            }
          ]
        },
        {
          "text": "Named customers asked for inventory alerts, not for the system to decide order quantities.",
          "anchors": [
            {
              "speaker": "D Lin Xiaolu",
              "ts": "03:22"
            },
            {
              "speaker": "D Lin Xiaolu",
              "ts": "03:55"
            }
          ]
        },
        {
          "text": "Hearth Kitchen would pay extra for alerts, about two or three thousand a year; Lin has QBR notes.",
          "anchors": [
            {
              "speaker": "D Lin Xiaolu",
              "ts": "07:15",
              "quote": "two or three thousand a year"
            }
          ]
        },
        {
          "text": "Strategy-meeting notes do not mention replenishment; Zhou said he did not put it first.",
          "anchors": [
            {
              "speaker": "B Su Qing",
              "ts": "06:58"
            },
            {
              "speaker": "E Zhou",
              "ts": "09:32"
            }
          ]
        },
        {
          "text": "Gao revised “twenty-plus owners” down to “seven or eight,” with no notes.",
          "anchors": [
            {
              "speaker": "A Gao Yuan",
              "ts": "10:15",
              "quote": "seven or eight for sure"
            }
          ]
        },
        {
          "text": "After Zhou left, Gao reset priority to “staff the demo first.”",
          "anchors": [
            {
              "speaker": "A Gao Yuan",
              "ts": "12:25"
            },
            {
              "speaker": "A Gao Yuan",
              "ts": "13:22"
            }
          ]
        }
      ],
      "evidenceNotes": [
        {
          "claim": "The “twenty-plus owners” Gao opened with have no written support",
          "status": "Confirmed",
          "strength": "High",
          "basis": "Source quote/paraphrase",
          "anchors": [
            {
              "speaker": "A Gao Yuan",
              "ts": "10:15",
              "quote": "No notes, no list"
            }
          ]
        }
      ]
    },
    {
      "title": "Source 2 · post-meeting group message (Gao Yuan)",
      "source": "S2",
      "status": "Confirmed",
      "notes": "Proves Gao stated the meeting this way. Does not prove the meeting made those conclusions.",
      "points": [
        {
          "text": "Calls replenishment “confirmed as a Q3 priority.”",
          "anchors": [
            {
              "source": "S2",
              "quote": "confirmed as a Q3 priority"
            }
          ]
        },
        {
          "text": "Puts alerts at “priority after the demo.”",
          "anchors": [
            {
              "source": "S2",
              "quote": "priority after the demo"
            }
          ]
        },
        {
          "text": "States “customer demand is validated.”",
          "anchors": [
            {
              "source": "S2",
              "quote": "customer demand is validated"
            }
          ]
        }
      ]
    }
  ],
  "openQuestions": [
    "Who are the seven or eight owners Gao mentioned, and did they ask the system to decide quantities or just to ping them.",
    "Of the eighty-something stores with records, how many are complete enough to train on.",
    "Whether Shelfwise actually shipped replenishment, and at what price (nobody checked in the room)."
  ],
  "decisions": [
    {
      "id": "D1",
      "decision": "Stand up inventory alerts first",
      "decidedBy": "E Zhou",
      "owner": "Ma Jun (engineering)",
      "due": "Q3 schedule, unset",
      "status": "Needs validation",
      "followUp": "At 13:22 Gao changed this to “priority after the demo”; the group message kept the rewrite",
      "anchors": [
        {
          "speaker": "E Zhou",
          "ts": "11:12",
          "quote": "alerts first"
        }
      ]
    },
    {
      "id": "D2",
      "decision": "A light replenishment demo for a few large accounts",
      "decidedBy": "E Zhou",
      "owner": "Gao Yuan (claimed at 11:28)",
      "due": "two weeks",
      "status": "Needs validation",
      "followUp": "The group message upgraded this to “confirmed as a Q3 priority” and dropped “keep the demo light”",
      "anchors": [
        {
          "speaker": "E Zhou",
          "ts": "11:12"
        },
        {
          "speaker": "E Zhou",
          "ts": "11:45",
          "quote": "Keep the demo light"
        },
        {
          "speaker": "A Gao Yuan",
          "ts": "11:28"
        }
      ]
    },
    {
      "id": "D3",
      "decision": "Revisit at the same time in two weeks",
      "decidedBy": "E Zhou",